{
  "schemaVersion": 3,
  "id": "doll-plain-focus",
  "name": "素净专注",
  "background": "none",
  "colors": {
    "accent": "#5c6b8a",
    "surface": "#f7f8fb",
    "text": "#2f3542"
  },
  "layout": {
    "x": 50,
    "y": 50,
    "veil": 50
  },
  "typography": {
    "sans": "\"Source Han Sans SC\", \"Noto Sans SC\", \"PingFang SC\", sans-serif",
    "mono": "\"JetBrains Mono\", ui-monospace, monospace"
  },
  "shape": {
    "radiusScale": 0.75,
    "shadow": "none"
  },
  "effects": {
    "scrollbar": "hidden"
  },
  "brand": {
    "startupTint": true
  },
  "terminal": {
    "black": "#3b4252",
    "red": "#bf616a",
    "green": "#a3be8c",
    "yellow": "#ebcb8b",
    "blue": "#81a1c1",
    "magenta": "#b48ead",
    "cyan": "#88c0d0",
    "white": "#e5e9f0",
    "brightBlack": "#4c566a",
    "brightRed": "#bf616a",
    "brightGreen": "#a3be8c",
    "brightYellow": "#ebcb8b",
    "brightBlue": "#81a1c1",
    "brightMagenta": "#b48ead",
    "brightCyan": "#8fbcbb",
    "brightWhite": "#eceff4"
  },
  "createdAt": "2026-07-16T00:00:00.000Z"
}